{"status":"PASS","batch_id":"CONCEPT-BATCH-003-C2-SLICE-001","manifest_sha256":"b1fb583d274865b94674fbf518b5ae81b395c2f5cc529bcb0522fe23a9c98cde","concept_table_sha256":"7caba0446da95419bb1d6ac154945f4b9b539c475ad14e2ae4e46e315b2291e0","assignment_input_sha256":"9466efcc8a87742f71d3edf520d20861a7e0f501c0c475c6aaf187d71effdc54","record_count":150,"ordered_key_sha256":"53ccfd52fa47aa82ff12c699dcbfc9db3a506be481f86f3530d19122d329af59","concept_decisions":[{"concept_label":"measurement_error_models","decision":"split","retained_canonical_name":"Measurement-error and misclassification correction methods","retained_family":"surveillance_measurement","labels_compared":"measurement_error_models; measurement_error_correction_methods; case_series_exposure_timing_error; latent_class_models; marginal_structural_models","evidence_inspected":"titles and complete available abstracts for all 43 slice records assigned to measurement_error_models; allowed concept labels and canonical names","rationale":"The slice mixes general measurement-error correction methods with distinct self-controlled case-series timing-error models, latent-class/diagnostic-error models, and causal-identification papers built around marginal structural or related estimands. The broad provisional label should be split, retaining the generic correction-method shard under the clearer allowed concept."},{"concept_label":"multiple_system_estimation","decision":"retain","retained_canonical_name":"Multiple-system estimation","retained_family":"surveillance_measurement","labels_compared":"multiple_system_estimation; capture_recapture","evidence_inspected":"allowed concept labels and canonical names; no slice records assigned to this label","rationale":"Multiple-system estimation is a distinct hidden-population estimand with assumptions about list dependence and interaction structure that should not be collapsed into generic capture-recapture."},{"concept_label":"observation_process_models","decision":"split","retained_canonical_name":"Observation-process, detection, and hidden-state models","retained_family":"surveillance_measurement","labels_compared":"observation_process_models; observation_reporting_process_models; partial_observation_epidemic_inference_methods","evidence_inspected":"titles and complete available abstracts for all 5 slice records assigned to observation_process_models; allowed concept labels and canonical names","rationale":"The records combine generic informative-observation-process models with epidemic partial-observation/data-assimilation methods and explicit reporting-process models. Those identification targets differ enough to require a split while retaining the hidden-state/detection core."},{"concept_label":"surveillance_measurement_designs","decision":"split","retained_canonical_name":"Surveillance system design, reporting practice, and measurement frameworks","retained_family":"surveillance_measurement","labels_compared":"surveillance_measurement_designs and the more specific allowed surveillance, causal-policy, forecasting, simulation, spatial, and evidence-synthesis concepts used for reassignment","evidence_inspected":"titles and complete available abstracts for all 102 slice records assigned to surveillance_measurement_designs; allowed concept labels and canonical names","rationale":"This is a residual catch-all containing burden reconstruction, data-validation studies, self-report bias work, pharmacovigilance, policy evaluations, transmission models with under-ascertainment, spatial clustering, and reviews. It must be split across more precise allowed concepts rather than retained as a junk drawer."},{"concept_label":"preferential_sampling","decision":"retain","retained_canonical_name":"Preferential-sampling models","retained_family":"surveillance_measurement","labels_compared":"preferential_sampling; spatial_regression_geostatistics","evidence_inspected":"allowed concept labels and canonical names; no slice records assigned to this label","rationale":"Preferential sampling encodes dependence between the observation locations and the latent process and is not interchangeable with ordinary spatial regression or geostatistics."},{"concept_label":"reporting_delay_nowcasting","decision":"merge","retained_canonical_name":"Reporting-delay adjustment and incidence nowcasting","retained_family":"surveillance_measurement","labels_compared":"reporting_delay_nowcasting; reporting_delay_adjustment_nowcasting; reproduction_number_nowcasting","evidence_inspected":"allowed concept labels and canonical names; no slice records assigned to this label","rationale":"The conflict is nominal duplication, not a substantive estimand split. The clearer allowed concept explicitly captures reporting-delay adjustment for incidence nowcasting and should retain the lineage."},{"concept_label":"sentinel_surveillance_calibration","decision":"split","retained_canonical_name":"Sentinel surveillance inference and calibration","retained_family":"surveillance_measurement","labels_compared":"sentinel_surveillance_calibration; sentinel_surveillance_inference_calibration; sentinel_surveillance_system_design_evaluation; sentinel_surveillance_system_implementation_evaluation","evidence_inspected":"allowed concept labels and canonical names; no slice records assigned to this label","rationale":"Calibration/extrapolation from sentinel systems should remain distinct from broader sentinel platform design and implementation evaluation, so the broad provisional label should be split."},{"concept_label":"syndromic_surveillance","decision":"merge","retained_canonical_name":"Syndromic surveillance systems","retained_family":"surveillance_measurement","labels_compared":"syndromic_surveillance; syndromic_surveillance_systems; outbreak_anomaly_detection","evidence_inspected":"allowed concept labels and canonical names; no slice records assigned to this label","rationale":"The provisional label duplicates the system-focused allowed concept; early-warning or anomaly-detection methods can be routed separately when present, so the lineage should merge into the cleaner system concept."}],"reassignments":[{"candidate_key":"PMID:19934191","from_concept_label":"measurement_error_models","to_concept_label":"marginal_structural_models","to_canonical_name":"Marginal structural models and inverse-probability weighting","to_family":"causal_policy","rationale":"Measurement-error correction is built into an MSM/IPW causal-effect estimator."},{"candidate_key":"PMID:20007675","from_concept_label":"measurement_error_models","to_concept_label":"measurement_error_correction_methods","to_canonical_name":"Measurement-error and misclassification correction methods","to_family":"surveillance_measurement","rationale":"Commentary centers on exposure and outcome misclassification correction."},{"candidate_key":"PMID:20053861","from_concept_label":"measurement_error_models","to_concept_label":"measurement_error_correction_methods","to_canonical_name":"Measurement-error and misclassification correction methods","to_family":"surveillance_measurement","rationale":"Proposes internal standardization to reduce assay measurement error."},{"candidate_key":"PMID:22764070","from_concept_label":"measurement_error_models","to_concept_label":"measurement_error_correction_methods","to_canonical_name":"Measurement-error and misclassification correction methods","to_family":"surveillance_measurement","rationale":"Develops paired-sample integration methods to correct cross-laboratory measurement error."},{"candidate_key":"PMID:22911898","from_concept_label":"measurement_error_models","to_concept_label":"case_series_exposure_timing_error","to_canonical_name":"Self-controlled case-series models with exposure-timing error","to_family":"surveillance_measurement","rationale":"Design paper is specific to case-series models with exposure-onset timing error."},{"candidate_key":"PMID:23650442","from_concept_label":"measurement_error_models","to_concept_label":"case_series_exposure_timing_error","to_canonical_name":"Self-controlled case-series models with exposure-timing error","to_family":"surveillance_measurement","rationale":"Introduces measurement-error case-series models for time-varying exposure onset."},{"candidate_key":"PMID:23731166","from_concept_label":"measurement_error_models","to_concept_label":"case_series_exposure_timing_error","to_canonical_name":"Self-controlled case-series models with exposure-timing error","to_family":"surveillance_measurement","rationale":"Inference paper remains within case-series exposure-timing-error methodology."},{"candidate_key":"PMID:23867812","from_concept_label":"measurement_error_models","to_concept_label":"pharmacovigilance_adverse_event_surveillance","to_canonical_name":"Pharmacovigilance and adverse-event surveillance","to_family":"surveillance_measurement","rationale":"Focus is sequential medical-product safety surveillance network design."},{"candidate_key":"PMID:23900718","from_concept_label":"measurement_error_models","to_concept_label":"measurement_error_correction_methods","to_canonical_name":"Measurement-error and misclassification correction methods","to_family":"surveillance_measurement","rationale":"Extends longitudinal adjustment methods for baseline and time-varying measurement error."},{"candidate_key":"PMID:24963890","from_concept_label":"measurement_error_models","to_concept_label":"measurement_error_correction_methods","to_canonical_name":"Measurement-error and misclassification correction methods","to_family":"surveillance_measurement","rationale":"Quantifies and adjusts inherent measurement error in Legionella culturing."},{"candidate_key":"PMID:26214336","from_concept_label":"measurement_error_models","to_concept_label":"measurement_error_correction_methods","to_canonical_name":"Measurement-error and misclassification correction methods","to_family":"surveillance_measurement","rationale":"Uses multiple overimputation for joint missing-data and measurement-error cor